{
  "$comment": "File generated by QAI. Do not edit by hand — it is regenerable. It is versioned so that CI replays deterministically and so that a self-repair shows up as a review diff.",
  "version": 2,
  "scenario": "cart-confirmation",
  "platform": "web",
  "recordedAt": "2026-08-22T18:00:00Z",
  "steps": {
    "s1": {
      "actions": [
        { "kind": "navigate", "to": "/" },
        {
          "kind": "fill",
          "target": { "primary": { "role": "searchbox", "name": "Rechercher un produit" } },
          "value": "chaise de bureau"
        },
        { "kind": "press", "key": "Enter" }
      ],
      "assertions": {
        "the result list holds at least one item": {
          "check": "countAtLeast",
          "target": { "role": "listitem", "within": { "role": "list", "name": "Résultats" } },
          "value": 1
        }
      },
      "healedAt": null
    },
    "s2": {
      "actions": [
        {
          "kind": "click",
          "target": {
            "primary": { "role": "link", "nth": 0, "within": { "role": "list", "name": "Résultats" } }
          }
        }
      ],
      "healedAt": null
    },
    "s3": {
      "actions": [
        {
          "kind": "click",
          "target": {
            "primary": { "role": "button", "name": "Ajouter au panier" },
            "fallback": { "testId": "add-to-cart" }
          }
        }
      ],
      "healedAt": null
    },
    "s4": {
      "actions": [
        {
          "kind": "click",
          "target": { "primary": { "role": "link", "name": { "contains": "Panier" } } }
        }
      ],
      "assertions": {
        "the cart holds at least one item": {
          "check": "countAtLeast",
          "target": { "role": "listitem", "within": { "role": "list", "name": "Articles du panier" } },
          "value": 1
        },
        "no network call fails": { "check": "noFailedRequests" },
        "the console stays clean": { "check": "noConsoleErrors" }
      },
      "healedAt": null
    },
    "s5": {
      "actions": [
        { "kind": "expectDialog", "response": "accept" },
        {
          "kind": "click",
          "target": { "primary": { "role": "button", "name": "Vider le panier" } }
        }
      ],
      "assertions": {
        "the cart is empty": {
          "check": "absent",
          "target": { "role": "listitem", "within": { "role": "list", "name": "Articles du panier" } }
        }
      },
      "healedAt": null
    }
  }
}

