{
  "$comment": "Fichier généré par QAI. Ne pas éditer à la main — il est régénérable. Il est versionné pour que la CI rejoue de façon déterministe et pour qu'une auto-réparation apparaisse en diff de revue.",
  "version": 1,
  "scenario": "panier-confirmation",
  "platform": "web",
  "recordedAt": "2026-08-22T18:00:00Z",
  "steps": {
    "s1": {
      "actions": [
        { "kind": "navigate", "to": "/" },
        {
          "kind": "fill",
          "target": { "primary": { "role": "searchbox", "name": "Rechercher un produit" } },
          "value": "chaise de bureau"
        },
        { "kind": "press", "key": "Enter" }
      ],
      "assertions": {
        "la liste de résultats contient au moins un article": {
          "check": "countAtLeast",
          "target": { "role": "listitem", "within": { "role": "list", "name": "Résultats" } },
          "value": 1
        }
      },
      "healedAt": null
    },
    "s2": {
      "actions": [
        {
          "kind": "click",
          "target": {
            "primary": { "role": "link", "nth": 0, "within": { "role": "list", "name": "Résultats" } }
          }
        }
      ],
      "healedAt": null
    },
    "s3": {
      "actions": [
        {
          "kind": "click",
          "target": {
            "primary": { "role": "button", "name": "Ajouter au panier" },
            "fallback": { "testId": "add-to-cart" }
          }
        }
      ],
      "healedAt": null
    },
    "s4": {
      "actions": [
        { "kind": "click", "target": { "primary": { "role": "link", "name": { "contains": "Panier" } } } }
      ],
      "assertions": {
        "le panier contient un article": {
          "check": "countAtLeast",
          "target": { "role": "listitem", "within": { "role": "list", "name": "Articles du panier" } },
          "value": 1
        },
        "aucun appel réseau n'échoue": { "check": "noFailedRequests" },
        "la console reste propre": { "check": "noConsoleErrors" }
      },
      "healedAt": null
    },
    "s5": {
      "actions": [
        { "kind": "expectDialog", "response": "accept" },
        { "kind": "click", "target": { "primary": { "role": "button", "name": "Vider le panier" } } }
      ],
      "assertions": {
        "le panier est vide": {
          "check": "absent",
          "target": { "role": "listitem", "within": { "role": "list", "name": "Articles du panier" } }
        }
      },
      "healedAt": null
    }
  }
}
