{
  "$comment": "File generated by QAI. Do not edit by hand — it is regenerable. It is versioned so that CI replays deterministically and so that a self-repair shows up as a review diff.",
  "version": 3,
  "scenario": "library-loan",
  "platform": "web",
  "recordedAt": "2026-10-17T21:37:51.671Z",
  "steps": {
    "s1": { "actions": [{ "kind": "navigate", "to": "." }], "healedAt": null },
    "s2": {
      "actions": [
        {
          "kind": "fill",
          "target": { "primary": { "role": "searchbox", "name": "Chercher une notice" } },
          "value": "Damasio"
        }
      ],
      "assertions": {
        "la liste des notices contient au moins deux entrées": { "check": "countAtLeast", "target": { "role": "listitem" }, "value": 2 }
      },
      "healedAt": null
    },
    "s3": {
      "actions": [
        {
          "kind": "click",
          "target": {
            "primary": { "role": "link", "nth": 0, "within": { "role": "list", "name": "Notices trouvées" } }
          }
        }
      ],
      "captures": {
        "ouvrage": { "from": { "role": "heading", "nth": 0 }, "extract": "text" },
        "cote": {
          "from": { "role": "text", "name": { "contains": "Cote" }, "within": { "role": "group" } },
          "extract": "text"
        }
      },
      "healedAt": null
    },
    "s4": {
      "actions": [{ "kind": "click", "target": { "primary": { "role": "button", "name": "Emprunter" } } }],
      "captures": {
        "reference": {
          "from": { "role": "text", "within": { "role": "group", "name": "Emprunt enregistré" }, "nth": 1 },
          "extract": "text"
        }
      },
      "assertions": {
        "l'emprunt est enregistré": { "check": "visible", "target": { "role": "heading", "name": "Emprunt enregistré" } },
        "une référence d'emprunt est affichée": {
          "check": "visible",
          "target": { "role": "text", "within": { "role": "group", "name": "Emprunt enregistré" }, "nth": 1 }
        }
      },
      "healedAt": null
    },
    "s5": {
      "actions": [],
      "assertions": {
        "la liste des emprunts contient la référence \"{{reference}}\"": {
          "check": "textContains",
          "target": { "role": "listitem", "within": { "role": "list", "name": "Liste des emprunts" } },
          "value": "{{reference}}"
        }
      },
      "healedAt": null
    }
  }
}
