{
  "$comment": "File generated by QAI. Do not edit by hand — it is regenerable. It is versioned so that CI replays deterministically and so that a self-repair shows up as a review diff.",
  "version": 2,
  "scenario": "compte-connecte",
  "platform": "web",
  "recordedAt": "2026-07-29T18:00:00Z",
  "steps": {
    "s1": {
      "actions": [{ "kind": "navigate", "to": "/" }],
      "assertions": {
        "l'en-tête salue le client par son nom": {
          "check": "textContains",
          "target": { "role": "text", "name": { "contains": "Bonjour" } },
          "value": "Alice"
        }
      },
      "healedAt": null
    }
  }
}

