{
  "$comment": "File generated by QAI. Do not edit by hand — it is regenerable. It is versioned so that CI replays deterministically and so that a self-repair shows up as a review diff.",
  "version": 2,
  "scenario": "checkout-guest",
  "platform": "web",
  "recordedAt": "2026-07-28T20:11:04Z",
  "appVersion": "a1b2c3d",
  "steps": {
    "s1": { "actions": [{ "kind": "navigate", "to": "/" }], "healedAt": null },
    "s2": {
      "actions": [
        {
          "kind": "fill",
          "target": { "primary": { "role": "searchbox", "name": "Rechercher un produit" } },
          "value": "chaise de bureau"
        },
        { "kind": "press", "key": "Enter" }
      ],
      "assertions": {
        "la liste de résultats contient au moins un article": {
          "check": "countAtLeast",
          "target": { "role": "listitem", "within": { "role": "list", "name": "Résultats" } },
          "value": 1
        }
      },
      "healedAt": null
    },
    "s3": {
      "actions": [
        {
          "kind": "click",
          "target": {
            "primary": { "role": "link", "nth": 0, "within": { "role": "list", "name": "Résultats" } }
          }
        }
      ],
      "captures": {
        "article": { "from": { "role": "heading" }, "extract": "text" },
        "prix": { "from": { "role": "text", "name": { "contains": "€" } }, "extract": "number" }
      },
      "healedAt": null
    },
    "s4": {
      "actions": [
        {
          "kind": "click",
          "target": {
            "primary": { "role": "button", "name": "Ajouter au panier" },
            "fallback": { "testId": "add-to-cart" }
          }
        }
      ],
      "assertions": {
        "l'indicateur du panier affiche 1 article": {
          "check": "textEquals",
          "target": { "role": "text", "within": { "role": "link", "name": { "contains": "Panier" } } },
          "value": "1"
        }
      },
      "healedAt": "2026-07-12T09:33:51Z",
      "healNote": "Le libellé du bouton est passé de « Ajouter » à « Ajouter au panier ». Cible relocalisée, assertion inchangée."
    },
    "s5": {
      "actions": [
        {
          "kind": "click",
          "target": { "primary": { "role": "link", "name": { "contains": "Panier" } } }
        }
      ],
      "assertions": {
        "le panier contient \"{{article}}\"": {
          "check": "visible",
          "target": {
            "role": "listitem",
            "name": { "contains": "{{article}}" },
            "within": { "role": "list", "name": "Articles du panier" }
          }
        },
        "le total est égal à {{prix}}": {
          "check": "numberEquals",
          "target": { "role": "text", "within": { "role": "group", "name": "Total" } },
          "value": "{{prix}}"
        }
      },
      "healedAt": null
    },
    "s6": {
      "actions": [
        {
          "kind": "click",
          "target": { "primary": { "role": "button", "name": "Commander en tant qu'invité" } }
        }
      ],
      "healedAt": null
    },
    "s7": {
      "actions": [
        {
          "kind": "fill",
          "target": { "primary": { "role": "textbox", "name": "Nom" } },
          "value": "Dupont"
        },
        {
          "kind": "fill",
          "target": { "primary": { "role": "textbox", "name": "Adresse" } },
          "value": "12 rue de la Paix"
        },
        {
          "kind": "fill",
          "target": { "primary": { "role": "textbox", "name": "Code postal" } },
          "value": "75002"
        },
        {
          "kind": "fill",
          "target": { "primary": { "role": "textbox", "name": "Ville" } },
          "value": "Paris"
        }
      ],
      "healedAt": null
    },
    "s8": {
      "actions": [
        {
          "kind": "fill",
          "target": { "primary": { "role": "textbox", "name": "Numéro de carte" } },
          "value": "4242424242424242"
        },
        {
          "kind": "fill",
          "target": { "primary": { "role": "textbox", "name": "Expiration" } },
          "value": "12/30"
        },
        {
          "kind": "fill",
          "target": { "primary": { "role": "textbox", "name": "Cryptogramme" } },
          "value": "123"
        },
        { "kind": "click", "target": { "primary": { "role": "button", "name": "Payer" } } }
      ],
      "captures": {
        "commande": { "from": { "role": "text", "name": { "contains": "CMD-" } }, "extract": "text" }
      },
      "assertions": {
        "la commande est confirmée": { "check": "visible", "target": { "role": "heading", "name": { "contains": "Merci" } } },
        "un numéro de commande est affiché": { "check": "visible", "target": { "role": "text", "name": { "contains": "CMD-" } } }
      },
      "healedAt": null
    },
    "s9": {
      "actions": [
        {
          "kind": "click",
          "target": { "primary": { "role": "link", "name": "Suivi de commande" } }
        }
      ],
      "assertions": {
        "le suivi affiche la commande \"{{commande}}\" au statut \"en préparation\"": {
          "check": "textContains",
          "target": {
            "role": "listitem",
            "name": { "contains": "{{commande}}" },
            "within": { "role": "list", "name": "Commandes" }
          },
          "value": "en préparation"
        }
      },
      "healedAt": null
    }
  }
}
